<?xml version="1.0" encoding="UTF-8"?>
<dokument xmlns:xsi="http://www.w3.org/2001/XMLSchema-instance" xsi:noNamespaceSchemaLocation="6.mockup.xsd">
	<titel>2 Bibliographie</titel>
	<autor/>
	<erscheinungsform>digital</erscheinungsform>
	<entstehungszeitraum>
		<von>
			<datum>2015-05-26</datum>
		</von>
		<bis>
			<datum>2019-04-15</datum>
		</bis>
	</entstehungszeitraum>
	<klassifizierungskategorie>Nicht Klassifiziert</klassifizierungskategorie>
	<datenschutz>false</datenschutz>
	<oeffentlichkeitsstatus>Nicht gepr√ºft</oeffentlichkeitsstatus>
	<oeffentlichkeitsstatusBegruendung/>
	<sonstigeBestimmungen/>
	<bemerkung/>
	<zusatzDaten>
		<merkmal name="Ordnerpfad">\Ordner B docx</merkmal>
		<merkmal name="Parentkey"/>
		<merkmal name="Thema"/>
		<merkmal name="Standort"/>
		<merkmal name="Dokumentdatum">26.05.2015</merkmal>
		<merkmal name="Schutzstufe"/>
		<merkmal name="ForeignDokReference"/>
		<merkmal name="BeschlussNummer"/>
		<merkmal name="SchluesselFremdsystem"/>
		<merkmal name="Tags"/>
	</zusatzDaten>
	<dateiRef repraesentation="2019-04-15T12:01:00" reihung="1">d00001.tif</dateiRef>
	<dateiRef repraesentation="2019-04-15T12:01:00" reihung="2">d00002.tif</dateiRef>
	<dateiRef repraesentation="2019-04-15T12:01:00" reihung="3">d00003.tif</dateiRef>
	<dateiRef repraesentation="2019-04-15T12:01:00" reihung="4">d00004.tif</dateiRef>
	<dateiRef repraesentation="2020-02-09T15:01:00">d000024.pdf</dateiRef>
</dokument>
